number,value,datetime_start,datetime_complete,duration,params_activation,params_adam_lr,params_hidden_layers,params_hidden_units,state
0,0.9053123809269559,2025-09-22 09:49:19.204883,2025-09-22 09:52:50.397857,0 days 00:03:31.192974,Sine,0.01,1,50,COMPLETE
1,0.07464445967428557,2025-09-22 09:52:50.398323,2025-09-22 09:57:51.976132,0 days 00:05:01.577809,Sine,0.1,3,75,COMPLETE
2,0.5678138938858714,2025-09-22 09:57:51.976603,2025-09-22 10:02:01.648316,0 days 00:04:09.671713,Sigmoid,0.01,2,25,COMPLETE
3,0.07435076646430365,2025-09-22 10:02:01.648918,2025-09-22 10:06:44.074539,0 days 00:04:42.425621,Tanh,0.001,3,50,COMPLETE
4,0.08636940726629558,2025-09-22 10:06:44.074828,2025-09-22 10:11:00.334445,0 days 00:04:16.259617,Sine,0.001,2,50,COMPLETE
5,0.0752523401527398,2025-09-22 10:11:00.334747,2025-09-22 10:15:47.146287,0 days 00:04:46.811540,Tanh,0.001,3,50,COMPLETE
6,0.07485513261924236,2025-09-22 10:15:47.146623,2025-09-22 10:20:02.543495,0 days 00:04:15.396872,Tanh,0.01,2,75,COMPLETE
7,0.17375639428830247,2025-09-22 10:20:02.543831,2025-09-22 10:24:21.758433,0 days 00:04:19.214602,Sigmoid,0.001,2,75,COMPLETE
8,0.07305468414835259,2025-09-22 10:24:21.759073,2025-09-22 10:29:23.903059,0 days 00:05:02.143986,Sine,0.1,3,75,COMPLETE
9,0.20194011847108984,2025-09-22 10:29:23.903474,2025-09-22 10:33:36.564987,0 days 00:04:12.661513,Sigmoid,0.001,2,50,COMPLETE
10,0.8854544850910774,2025-09-22 10:33:36.565341,2025-09-22 10:35:11.197581,0 days 00:01:34.632240,Sine,0.1,1,25,COMPLETE
11,0.6539530367074884,2025-09-22 10:35:11.197917,2025-09-22 10:40:02.344248,0 days 00:04:51.146331,Tanh,0.1,3,75,COMPLETE
12,0.9971287125104566,2025-09-22 10:40:02.344582,2025-09-22 10:44:51.229727,0 days 00:04:48.885145,Tanh,0.1,3,75,COMPLETE
13,0.07469616025314364,2025-09-22 10:44:51.230722,2025-09-22 10:49:43.530348,0 days 00:04:52.299626,Sine,0.001,3,50,COMPLETE
14,1.0000008569967944,2025-09-22 10:49:43.530629,2025-09-22 10:50:15.640860,0 days 00:00:32.110231,Tanh,0.1,3,25,COMPLETE
15,0.07424851267734409,2025-09-22 10:50:15.641243,2025-09-22 10:55:07.297177,0 days 00:04:51.655934,Sine,0.001,3,50,COMPLETE
16,0.07481487120432703,2025-09-22 10:55:07.297733,2025-09-22 11:00:08.334487,0 days 00:05:01.036754,Sine,0.1,3,75,COMPLETE
17,0.7580316431716266,2025-09-22 11:00:08.334788,2025-09-22 11:03:42.848390,0 days 00:03:34.513602,Sine,0.1,1,75,COMPLETE
18,0.07471701727939764,2025-09-22 11:03:42.848815,2025-09-22 11:08:32.306639,0 days 00:04:49.457824,Sine,0.001,3,50,COMPLETE
19,0.07348570599748755,2025-09-22 11:08:32.307222,2025-09-22 11:13:18.910846,0 days 00:04:46.603624,Sine,0.01,3,25,COMPLETE
20,0.9258220933057546,2025-09-22 11:13:18.911209,2025-09-22 11:15:36.886766,0 days 00:02:17.975557,Sine,0.01,1,25,COMPLETE
21,0.07432124323429787,2025-09-22 11:15:36.887333,2025-09-22 11:20:20.960444,0 days 00:04:44.073111,Sine,0.01,3,25,COMPLETE
22,0.07378948153175374,2025-09-22 11:20:20.961068,2025-09-22 11:25:04.796748,0 days 00:04:43.835680,Sine,0.01,3,25,COMPLETE
23,0.0743020959168275,2025-09-22 11:25:04.797272,2025-09-22 11:29:50.224069,0 days 00:04:45.426797,Sine,0.01,3,25,COMPLETE
24,0.07398191912350913,2025-09-22 11:29:50.224445,2025-09-22 11:34:31.149394,0 days 00:04:40.924949,Sine,0.01,3,25,COMPLETE
25,0.18131349802225433,2025-09-22 11:34:31.150365,2025-09-22 11:39:11.287437,0 days 00:04:40.137072,Sigmoid,0.01,3,25,COMPLETE
26,0.07374423665752984,2025-09-22 11:39:11.288118,2025-09-22 11:43:57.984385,0 days 00:04:46.696267,Sine,0.01,3,25,COMPLETE
27,0.07424996406232134,2025-09-22 11:43:57.984746,2025-09-22 11:48:46.396236,0 days 00:04:48.411490,Sine,0.01,3,25,COMPLETE
28,1.2875566255247148,2025-09-22 11:48:46.397348,2025-09-22 11:50:08.853714,0 days 00:01:22.456366,Sine,0.01,1,25,COMPLETE
29,0.07459953994375654,2025-09-22 11:50:08.854114,2025-09-22 11:55:14.345374,0 days 00:05:05.491260,Sine,0.01,3,75,COMPLETE
30,0.973273814651081,2025-09-22 11:55:14.346013,2025-09-22 11:58:56.100455,0 days 00:03:41.754442,Sigmoid,0.1,1,25,COMPLETE
31,0.07370721110320541,2025-09-22 11:58:56.101108,2025-09-22 12:03:41.809531,0 days 00:04:45.708423,Sine,0.01,3,25,COMPLETE
32,0.07428030585491319,2025-09-22 12:03:41.810079,2025-09-22 12:08:31.884509,0 days 00:04:50.074430,Sine,0.01,3,25,COMPLETE
33,0.07433012177622925,2025-09-22 12:08:31.885258,2025-09-22 12:13:16.789297,0 days 00:04:44.904039,Sine,0.01,3,25,COMPLETE
34,0.07438649847770312,2025-09-22 12:13:16.789747,2025-09-22 12:18:02.620877,0 days 00:04:45.831130,Sine,0.01,3,25,COMPLETE
35,0.07502948522391592,2025-09-22 12:18:02.621380,2025-09-22 12:22:47.465464,0 days 00:04:44.844084,Sine,0.01,3,25,COMPLETE
36,0.07461087611418717,2025-09-22 12:22:47.465756,2025-09-22 12:27:46.646696,0 days 00:04:59.180940,Sine,0.01,3,75,COMPLETE
37,0.2506114504538051,2025-09-22 12:27:46.647051,2025-09-22 12:31:54.815882,0 days 00:04:08.168831,Sine,0.1,2,25,COMPLETE
38,0.0856135546517689,2025-09-22 12:31:54.816458,2025-09-22 12:36:48.745189,0 days 00:04:53.928731,Sigmoid,0.01,3,75,COMPLETE
39,0.11727894307646819,2025-09-22 12:36:48.745637,2025-09-22 12:41:00.452635,0 days 00:04:11.706998,Sine,0.01,2,25,COMPLETE
40,0.940782520238935,2025-09-22 12:41:00.452970,2025-09-22 12:43:27.181217,0 days 00:02:26.728247,Tanh,0.1,3,75,COMPLETE
41,0.073688271464687,2025-09-22 12:43:27.181535,2025-09-22 12:48:10.423175,0 days 00:04:43.241640,Sine,0.01,3,25,COMPLETE
42,0.07349595218039703,2025-09-22 12:48:10.423553,2025-09-22 12:52:53.306167,0 days 00:04:42.882614,Sine,0.01,3,25,COMPLETE
43,0.07326329409009996,2025-09-22 12:52:53.306751,2025-09-22 12:57:37.826895,0 days 00:04:44.520144,Sine,0.01,3,25,COMPLETE
44,0.073606575614485,2025-09-22 12:57:37.827173,2025-09-22 13:02:22.643620,0 days 00:04:44.816447,Sine,0.01,3,25,COMPLETE
45,0.1288694148776913,2025-09-22 13:02:22.643918,2025-09-22 13:06:33.635365,0 days 00:04:10.991447,Sine,0.01,2,25,COMPLETE
46,1.0052175101359877,2025-09-22 13:06:33.636005,2025-09-22 13:11:20.851232,0 days 00:04:47.215227,Sigmoid,0.1,3,50,COMPLETE
47,0.07466378711669683,2025-09-22 13:11:20.851941,2025-09-22 13:16:07.655500,0 days 00:04:46.803559,Tanh,0.01,3,75,COMPLETE
48,0.0736835172225059,2025-09-22 13:16:07.655776,2025-09-22 13:20:52.661102,0 days 00:04:45.005326,Sine,0.001,3,25,COMPLETE
49,0.8628516657823895,2025-09-22 13:20:52.661595,2025-09-22 13:22:00.387035,0 days 00:01:07.725440,Sine,0.1,1,25,COMPLETE
